quote,entity 1,sentiment 1,confidence 1,entity 2,sentiment 2,confidence 2,entity 3,sentiment 3,confidence 3,entity 4,sentiment 4,confidence 4
"Rice is Liberia s staple food, but we do not produce it. The new rice investment program backed by the European Investment Bank and the European Union ensures that Liberia can accelerate sustainable development and avoid food price shocks by increasing local rice production. On behalf of all Liberians I wish to express my gratitude to the EIB and the European Union for working with Liberia to develop our country s rice value chain and improving food security for Liberians.",rice,3,3,European Investment Bank,3,3,European Union,3,3,,,
"For more than two decades now, IITA has been working with partners within and outside Africa on Aflasafe.",IITA,3,3,,,,,,,,,
"Concern Over Ogun Cotton ABP Stalemate,",Ogun Cotton ABP,1,3,,,,,,,,,
"Under the second window, a United Kingdom-based private investor, House of Dorcas Industrial Cotton (HDIC) sought to partner with the Southwest zone of the association with particular reference to Ogun, Oyo, Osun, Ondo and Ekiti states.",House of Dorcas Industrial Cotton (HDIC),2,3,,,,,,,,,
"Onwuegbucha recalled. Ever since, she followed my work and progress. In 2017, while I was studying at the University of Leeds, she called to encourage me and enquire about my future plans. At the end of my programme, she visited me in London and invited me to work with her at [the] CCA, Lagos. That was how Bisi has nurtured numerous young curators across Africa. Always looking out for emerging talents, eager to give advice and encouragements…",Bisi,3,3,,,,,,,,,
The Green Field Day demonstrations is a testimony to the incredible efforts on the part of NASC and the seed entrepreneurs in ensuring availability and accessibility of multiple options of high quality improved seeds for farmers to choose from.,NASC,3,3,seed entrepreneurs,3,3,,,,,,
in furtherance to the Bank s commitment towards supporting maize farmers,Bank,3,3,,,,,,,,,
The maize Pyramids will go down in history as the first maize pyramid in Nigeria which demonstrates not only the resilience of our farmers but also the commendable vision of the Federal Government of Nigeria through the implementing partners. This should be replicated in all states with a focus on the crops that have comparative advantage.,maize Pyramids,3,3,the Federal Government of Nigeria,3,3,,,,,,
Unity Bank is fully committed to its partnership with MAAN and this commitment will ensure the attainment of FGN/CBN target to meeting self-sufficiency in Maize production through the Association,Unity Bank,3,3,,,,,,,,,
"We cannot appreciate enough our financing partners, especially Unity Bank. Today we have over 50,000 bags of maize in this pyramid, which will contribute significantly to Nigeria s strategic grain reserves. This could not have been possible without the financing made possible by these partners. We commend them for this role and remain grateful.",Unity Bank,3,3,,,,,,,,,
"While the Wema hybrid maize varieties are high yielding and drought tolerant, they are quite susceptible to fall armyworms and stem borers. These pests consume 25 million bags, hence the country will remain food insecure and reliant on imports,",Wema hybrid maize,4,3,,,,,,,,,
"At the end at Bayern it was difficult - with the relationship between the president (Hoeness) and him. I think (dropping me) was a bad decision. It was not understandable. Until the winter break, we were in every competition and successful, and through that decision it changed the run of things and that was one of the first steps towards his dismissal.",Bayern,1,3,,,,,,,,,
"Apple has done a number of things well for privacy but it is not always going to be about the iPhone X,",Apple,4,2,,,,,,,,,
"What Apple is doing here will popularize and get people more comfortable with the technology,",Apple,3,3,,,,,,,,,
"If I look at Apple s track record of making things easy for consumers, I am optimistic users are going to like this.",Apple,3,3,,,,,,,,,
"I used to harvestless than five bags of maize per acre of farming but through new developed seeds, I can now harvest up to twenty bags of maize on the same piece of land,",new developed seeds,3,3,,,,,,,,,
"I harvested 60 bags of maize from two acres of land of which I sold 55 bags and kept five for food,",maize,2,3,,,,,,,,,
"Previously, it was hard to see a person in Kagera region using maize flour. Those who were doing so, did it secretly because it was associated with hunger or poverty,",maize,4,2,,,,,,,,,
"Maize farming has brought change to my life as I have managed to pay fees for my kids, buy clothes, books and he recently bought a power tiller which also boosts his income through farming other villagers farms,",maize,3,3,,,,,,,,,
"Sorghum has antican­cer potential, has complex carbohydrates to manage diabetes, has gluten-free grain option, improves bone health, increases circula­tion, and contains energy boosting nutrients,",Sorghum,3,3,,,,,,,,,
"A bag of each of prod­uct contains 12 packs. Hy­fiba Meal is a highly nutri­tious product made from Sorghum and Soyabean. It can be made like Amala or Tuwo as swallow,",Hyfiba Meal,3,3,,,,,,,,,
The project is also a demonstration of the Bank s efforts to accelerate the implementation of the Bank s Jobs for Youth in Africa Strategy as well as operationalize the African Nutrition Accountability Score Card (ANASC) launched in 2019.,Bank,3,2,,,,,,,,,
"As I am speaking with you we have on ground-from last year anchor borrower programme, over 10,000 metric tonnes of maize that have been returned as payment by farmers but we have been able to sell it,",maize,2,3,,,,,,,,,
he launched the anchor borrowers programme and now he is fully assured that the programme is working and is starting here in Daura where nobody knows Daura as a maize farming community.,the anchor borrowers programme,3,3,,,,,,,,,
We are confident that you (Gambari) will build on the achievement of the president towards ensuring that Nigeria remains food secured; especially self-sufficiency in Rice production.,Gambari,3,3,achievement of the president,3,3,,,,,,
"We heard then that apart from the former DG and the senior officials, some NABDA officials were also mentioned as having taken part in the financial crime. But I am not sure if this present case is the same as the 2018 case or a fresh one,",the former DG,1,3,senior officials,1,3,some NABDA officials,1,3,,,
"Sugarcane cultivation is an opportunity to improve farmers welfare. People who put emphasis on sugarcane farming will be able to change their lives,",sugarcane,3,3,,,,,,,,,
"Pakistanis constitute the fourth largest population of skilled workers in the Silicon Valley after the US, India and Romania and Pakistan also exports vast amounts of ICT apps to US companies including Apple,",Pakistanis,3,3,US,3,3,India,3,3,Romania,3,3
"We highly appreciate Wolfgang s contribution to ASML s growth and development over recent years, and we looked forward to many more years of working together. Yet, we also appreciate that Bayer offers Wolfgang a significant opportunity and we wish him and Bayer all the best. Together with Wolfgang we will arrange for a smooth transition of his responsibilities over the coming months and secure uninterrupted execution of our strategy to reach our stated targets for our stakeholders,",Wolfgang,3,3,Bayer,3,3,Wolfgang,3,3,,,
"This Tomato Ebola that attacks Kano State will contribute to tomato scarcity if care is not taken. The price will further increase and this increment may last for months,",Tomato Ebola,1,3,,,,,,,,,
"Maize seed prices for some of the most popular cultivars have increased by an average of 5.6% since last year, while the average of all the maize cultivars has increased by about 3.3%. Sunflower seed prices increased by an average of 3.7% and soybean seed prices increased by 2.6%.",maize seed prices,2,3,maize cultivars,2,3,sunflower seed prices,2,3,soybean seed prices,2,3
"Ammonium nitrate prices, for example, have risen to US$800 per tonne from US$650 per tonne, while high spec tobacco blends can reach US$1100 from US$800 per tonne. Electricity tariffs have also been reviewed upwards. Increased generator use will also contribute to an increase in production costs. Interest rates of between 8% and 10% become a significant cost. Tobacco prices have to take into account these significant increases in production costs. Viability of the sector is already on a knife s edge. Production is not forecast to increase, and if not addressed adequately this season, will result in a further decline in growers willing to take part in tobacco farming,",ammonium nitrate prices,1,3,high spec tobacco blends,1,3,electricity tariffs,1,3,tobacco prices,4,1
"Rural farmers planted maize on 78ha of land with support from our department, the municipality, Jobs Fund and Grain SA. Farmers estimate harvesting 70 to 80 bags of maize, giving an average yield between 4-5 tons a hectare from these deep soils. We have to link them to the markets to process their maize, create jobs and we must look at helping them with fencing,",our department,3,3,the municipality,3,3,Jobs Fund,3,3,Grain SA,3,3
"It is possible that farmers can produce, sell and keep some of the maize for their consumption,",maize,3,3,,,,,,,,,
"NAADS, EAAP and National Agriculture Research Organization (NARO) teamed up to change the mindset of people but mostly the youth, women and the PWDs in agriculture in order to reduce the rate of unemployment and dependency,",NAADS,3,3,EAAP,3,3,National Agriculture Research Organization (NARO),3,3,,,
"The need to ensure that Lake Rice circulates into the nooks and crannies of the state is key in our drive to attain food sufficiency. Food production and self-sufficiency have been given priority attention at State s policy and strategic levels, this is aimed at sustaining Lagos because our state is the largest consumer of food commodity in Nigeria,",Lake Rice,3,3,,,,,,,,,
"We have learnt how to protect ourselves and I thank IITA for training us. This training is an eye opener to all of us,",IITA,3,3,,,,,,,,,
"What the IITA-CWMP has set out to do is to promote integrated weed management options, combining mechanical, agronomy, and chemical weed control so that farmers are able to control weeds in a sustainable manner,",IITA-CWMP,3,3,,,,,,,,,
"Through our newly incorporated Westlink Integrated Farms Limited, we have commenced varietal tomato cultivation at our 3,500 hectares Imeko farmland in Ogun State. The business plan is to run a model farm that also supports out-growers scheme where our tomato to paste processing plant will guarantee the market for all produce in the locality. This farm is supported by Fidele Aggregation Limited, a Nigerian company with the technical backing of the world-renowned Syngenta AG of Switzerland. This venture is planned to have stabilized large scale tomato cultivation for a 120-ton a day tomato to paste modular processing plant to be installed by its third year of cultivation.",tomato,3,2,Fidele Aggregation Limited,3,3,,,,,,
"The 2017/2018 report from the Rice Farmers Association (RIFAN) shows that they have the capacity to produce 10 million tons of rice but that as at today only two million is being utilised with 30 Integrated rice mills that are available currently leaving a shortfall of 8 million, but going forward I see opportunities, I see jobs, I see wealth being created and see better nutrition,",Rice Farmers Association (RIFAN),4,3,,,,,,,,,
We say no to maize importation into Nigeria and we will always support the Central Bank of Nigeria for denying maize importers forex because the CBN supports President Muhammadu Buhari s agenda of ,maize importation,1,3,Central Bank of Nigeria,3,3,,,,,,
as far as maize is concerned we can produce enough for our consumption and industrial use,maize,3,3,,,,,,,,,
"The success of the Anchor Borrower s Programme lies in our conduct as maize farmers, we, therefore, need to be optimistic in our thoughts and in repaying our loans as at when due for the survival of the programme",Anchor Borrower s Programme,3,2,,,,,,,,,
This maize pyramid unveiling programme marks another milestone in the CBN Anchor Borrower s story and further demonstrates the progress we made in with commodity association towards attaining Food sufficiency in Nigeria,CBN Anchor Borrower,3,3,,,,,,,,,
"We also hosted the Governor of the Central Bank of Nigeria, Mr. Godwin Emefiele and other dignitaries to launch the Ekiti State Rice Pyramid Scheme aimed at empowering our local rice farmers to boost production and create more jobs and opportunities in the agriculture value-chain in the state.",Ekiti State Rice Pyramid Scheme,3,3,,,,,,,,,
"Maize exports to Zimbabwe could be one of the main reasons why our maize stock is so low because they also experienced drought and could only import maize from South Africa because of the export ban from other neighbouring countries,",maize exports,1,2,,,,,,,,,
"The long-term outlook of Syngenta is good, so I can understand that they are asking for a higher premium,",Syngenta,3,2,,,,,,,,,
"A vastly improved maize yield implies that prices will not be adversely impacted on and would, therefore, have a significantly positive impact on the profitability of the major producers. Improved crop production figures support our belief that any tariff adjustments of the magnitude proposed are untenable and unjustified,",maize,3,2,,,,,,,,,
"The kids of today are very expressive, adventures and free, they come wearing their own identity. Cotton Fest gives them the space to be whoever they want to be,",Cotton Fest,3,3,,,,,,,,,
"The Youth Ag-Summit forms part of the new Agricultural Education Program by Bayer CropScience which takes a holistic approach. At Bayer CropScience, we believe in engaging in a constructive, forward-looking dialogue about the challenges and opportunities of farming. We commit to help the next generation of young thought leaders learn and grow themselves, as we strive to drive a sustainable intensification of agriculture,",The Youth Ag-Summit,3,3,Agricultural Education Program,3,3,Bayer CropScience,3,3,,,
"Bayer CropScience is committed to engaging tomorrow s thought leaders - with initiatives like the 2015 Youth Ag-Summit, agricultural scholarships and hands-on learning programmes at our labs and farms. Young people are encouraged to learn more about sustainable agriculture and food supply whereby the vital role of science and innovation is highlighted,",Bayer CropScience,3,3,the 2015 Youth Ag-Summit,3,3,agricultural scholarships,3,3,hands-on learning programmes,3,3
"We expect all concerned stakeholders to strictly adhere to procedures which are governed by the law, or else be in contempt of the Cotton Industry Act (Act No. 2 of 2001),",stakeholders,1,2,,,,,,,,,
"Cotton production is an important industry in Mozambique, contributing to around a fifth of agricultural exports, but the abandonment of cotton production by farmers in the sector and some farming companies is negatively influencing the production indices of this cash crop in the province of Zambézia, which has has been harvesting less than 5,000 tons per season hence we need high profile actors",cotton,4,3,,,,,,,,,
"Under the new research focus, IITA committed to revive its weed management research; rehabilitate an office building, procure equipment, and hired staff",IITA,3,3,,,,,,,,,
This is happening at the University of the Free State and the University of Pretoria.,University of the Free State,2,2,University of Pretoria,2,2,,,,,,
"Cassava, for instance, has been recognized to be a product with immense potential for contributing to economic growth, hence the establishment of the African Cassava Initiative being implemented at regional and national levels,",cassava,3,3,,,,,,,,,
"Shortly after coming out of Makerere University, I served briefly as a volunteer with NAPE (National Association for Professional Environmentalists). It was an opportunity for me to learn about environmental issues in a more practical way and to meet several unique people that gave me encouragement to begin working on establishing the centre.",NAPE (National Association for Professional Environmentalists),3,3,,,,,,,,,
"The cost of maize production in Uganda is less since little or no fertiliser is applied, compared with our case.",cost of maize,2,2,,,,,,,,,
"We are not supposed to stop maize from coming in; we are a bloc, we are East African Community and we have signed a protocol. We challenge our farmers to be more competitive in crops production to remain relevant in the market,",East African Community,3,2,,,,,,,,,
"We respect the EAC common market protocol, but the government should cushion us from unfair competition by cheap, subsidised maize,",government,4,2,,,,,,,,,
"We are experiencing steady delivery of maize to our depots as more farmers continue to harvest the crop,",delivery of maize,3,2,,,,,,,,,
"Policy inspectors have been deployed to our buying centres to vet and ensure that the imported, subsidised maize from neighbouring countries do not end up in our stores,",policy inspectors,3,3,maize from neighbouring countries,1,3,,,,,,
"But we thought in our submissions we had made through the Tobacco Industry and Marketing Board (TIMB) and the Ministry of Agriculture, it was clear that we required a minimum of 82 percent as retention level,",Tobacco Industry and Marketing Board (TIMB),2,3,Ministry of Agriculture,2,3,,,,,,
"Maize prices will fall further in coming days as most bulk buyers are fetching the coarse grain from Bihar at lower price,",maize prices,2,3,,,,,,,,,
"Maize requires 22 millimetres and above to germinate and 30mm to 35mm for soya beans. Not much rains have fallen and the chances of experiencing long periods of dry spell are quite high. The crop may germinate now but can be affected by the dry spell,",maize,4,3,,,,,,,,,
"I wish they would start to get in contact with academic institutions such as ours and the University of Pretoria who are working on listeria in different types of environments, because we have some information we would like to share with them,",academic institutions,3,3,University of Pretoria,3,3,,,,,,
"Farmers will be interested in the cultivation of maize only if it is profitable. We must project maize as a surplus crop,",maize,2,3,,,,,,,,,
"Investors and entrepreneurs can be rest assured they will get full cooperation from the Bihar government. We want maize to be used enterprisingly in Bihar and industry has a key role to play in it,",Bihar government,3,3,maize,2,3,,,,,,
"Maize also qualifies as a potential crop for doubling farmer s income. Over the last decade, maize consumption in India grew at a CAGR of 5.6 per cent while production grew at just about 2.9 per cent. Looking at the rising demand for maize, there is an imminent need to establish a clear road map for this sector,",maize,3,3,maize consumption,2,3,production,1,3,,,
"The Ministry will support the oilpalm farmers, with 5,000 improved oilpalm sprouted nuts and 1,500kg improved cashew seed, the cocoa farmers will also be supported with 20,000 cocoa seedlings and agrochemicals. In addition, Rice farmers will be supported with 1,000 kg of rice seeds.",The Ministry,3,3,,,,,,,,,
"for this to happen we need to work in partnership. The key driver to all IITA has been able to achieve is partnership from donators, government and non-government organisations.","partnership from donators, government and non-government organisations",3,2,,,,,,,,,
"This is a pilot project between the Visegrad Group and INRA that will mark the beginning of a multilateral partnership in Morocco,",Visegrad Group,2,3,INRA,2,3,,,,,,
"Condi Rice asked me what I wanted to say to the president,",Condi Rice,2,3,,,,,,,,,
And to help us solve the conflict that we have in the country. We can solve it with science technology and innovation can help us solve it and it is NABDA that we are looking up to perform this role.,NABDA,3,3,,,,,,,,,
"We are pleased with the transparent and rigorous selection process adopted by the AfricaRice Board of Trustees,",AfricaRice Board of Trustees,3,3,,,,,,,,,
"We have full confidence that Dr Roy-Macauley has the leadership experience, skills and vision needed to advance the noble mission of AfricaRice.",Dr Roy-Macauley,3,3,AfricaRice,3,3,,,,,,
"Compared to others, the drought-tolerant maize varieties can withstand such disruptions in moisture content or rainfall quantities and still do well,",drought-tolerant maize,3,3,,,,,,,,,
"This project therefore aims at developing maize varieties that will do well under high or low amounts of fertiliser use, so that farmers can be guaranteed of good yield with whatever amount of fertiliser they can afford to buy,",maize,3,3,,,,,,,,,
"Having access to maize varieties that will efficiently use the small amounts of nitrogen left in the soil— and still do well—will thus cushion farmers from yield losses,",maize,3,3,,,,,,,,,
"With new maize varieties that use nitrogen and other soils nutrients efficiently, we will be able to achieve this and remain food secure,",maize,3,3,,,,,,,,,
"The maize lethal necrosis disease has caused losses worth millions of dollars for farmers and seed companies in the affected regions in sub-Saharan Africa,",maize lethal necrosis disease,1,3,,,,,,,,,
Maize is both a food and cash crop and the effects of MLN also affect food consumers since farmers have no maize crop to release to the market. This therefore calls for urgent need to find a sustainable and widely applicable solution.,maize,3,3,MLN,1,3,,,,,,
"Google and Apple have as good a chance as anyone at grabbing the car ecosystem,",Google,2,3,Apple,2,3,,,,,,
"Maize is rangebound bet-ween R1 880 and R1 920 and it is really just tracking Chicago and the currency, both of which kind of offset each other for the day,",maize,2,2,,,,,,,,,
"Potatoes are very difficult to produce, you need land and access to capital.",potatoes,1,3,,,,,,,,,
"What I am saying in essence is this, now, we have about 12 exiting integrated rice mills in Nigeria and about 15 or more are coming up, some like Labana Rice Mill is expanding from 16 tonnes per house to 36 tonnes per hour. These are investments of people that are willing to support the government to produce enough rice for Nigerians,",integrated rice mills,3,3,Labana Rice Mill,3,3,,,,,,
"Before the pandemic, a bag of maize was between N8,000 to N11,000 in the open market, but now the price has fallen,",maize,2,3,,,,,,,,,
"Monsanto Agriculture Nigeria Ltd did not apply for field trials of GMO cotton,",Monsanto Agriculture Nigeria Ltd,1,3,,,,,,,,,
"This is very different from confined field trials as is the case with the permit for GMO maize - which, in any case, we equally object to.",GMO maize,1,3,,,,,,,,,
"We consider it intriguing and suspicious that a mere one working day after this letter, the DG of NBMA issued permits to Monsanto,",DG of NBMA,1,3,,,,,,,,,
"We are concerned that NBMA and NABDA keep going around hyping myths sold by the biotech industry to an unsuspecting public, while being careful not to reveal to citizens that they had rushed to issue permits a mere two months after the applications were advertised.",NBMA,1,3,NABDA,1,3,biotech industry,1,3,,,
"We also objected to Monsanto s applications in Nigeria on many grounds,",Monsanto,1,3,,,,,,,,,
It took NBMA just a month after 22 days window period given to the Nigerian public to submit comments on the applications submitted by Monsanto to issue two Permits to Monsanto to deploy GMOs in Nigeria.,NBMA,2,3,,,,,,,,,
"They either need to follow the YouTube model or the Apple NeXT acquisition, where NeXT ended up essentially running the company, and then with YouTube, Google did the thing of letting them preserve their brand, their headquarters, and slowly pulling them into the company but not trying to disturb it too much - so it feels like some combination of that is going to be needed.",YouTube,3,3,Apple NeXT,3,3,Google,3,3,,,
"Also the leaf can be processed into trays, slippers, toothpaste and cups among others. Cassava also has many uses that could be improved upon to earn forex for the country. From cassava, we can get ethanol, noodles, beverages, clothing materials, glucose and soap,",cassava,3,3,,,,,,,,,
"I went to Makerere University and got more knowledge about the flies and also got an expert in in insects to manage my innovation,",Makerere University,3,3,,,,,,,,,
"By delivering our high-resolution ClearAg hail data to BASF, we are empowering their sales and support staff, as well as their YOU.S. Crop Protection customers, with actionable information for more proactive field response,",BASF,3,3,,,,,,,,,
"I wish to emphasise that the Lagos State government through the Ministry of Agriculture has developed agricultural initiatives aimed at addressing these challenges, the recent breakthrough in rice-agribusiness readily comes to mind, considering the collaboration between Lagos and Kebbi States on a large production, processing and distribution of the LAKE Rice product,",Lagos State government,3,3,Ministry of Agriculture,3,3,,,,,,
"This is part of our international engagement and also an invitation supported by National Biotechnology Development Agency (NABDA), we are working on MOU with the goal to develop more productive research where joint grant submission will be done to generate more funding for research to continue,",National Biotechnology Development Agency (NABDA),3,2,,,,,,,,,
"We are expecting that by this year or next year, President Buhari will stop maize importation in Nigeria just like he did with rice, since we are producing more than enough",President Buhari,3,3,,,,,,,,,
