quote,entity 1,sentiment 1,confidence 1,entity 2,sentiment 2,confidence 2,entity 3,sentiment 3,confidence 3,entity 4,sentiment 4,confidence 4
"Also we enhanced maize production in South South and South East. What they are producing there is more now. In the Northern part of Nigeria, if you look at Katsina State, there were a lot of areas where they were not producing maize, but because of the different varieties we got under this administration, they are now producing maize",maize,2,3,,,,,,,,,
"Cassava starch producers are largely rural companies basically and infrastructure in rural are very poor, the government is making some efforts and we can see it, however, we want it accelerated so that Nigeria can take rightful place as the biggest processors of cassava, that is our aim.",cassava,4,2,,,,,,,,,
"Despite this achievement of having more than 50 million tons of annual production, there are still challenges that are still confronting the Cassava crop. Our yield per hectare is still low (less than 10 tons per hectare), we are still battling with the problem of cyclical glut, there are still processing challenges, weeds are still problems in cassava, and several others. Consequently, Nigeria is yet to tap the full potential of cassava crop which is estimated at $5 billion annually.",cassava,4,3,,,,,,,,,
"Maize constitutes between 50 per cent to 70 per cent of chicken feeds. It is the cardinal input of poultry business. Due to high demands for maize by humans, there has been an unhealthy competition for this all important staple food. The problems of insecurity and flooding has made it impossible for farmers to go to the farm. The few tonnage of maize has been hijacked and cornered by speculators, opportunists and political jobbers who also think it is their birthright to dictate the going in the industry.",maize,2,3,,,,,,,,,
"We depend on our farms, but we have been turned into beggars by the monkeys and the pests that have invaded our farms. The little maize that survives the pests is destroyed by the monkeys,",monkeys,1,2,pests,1,2,,,,,,
"Last season I harvested only one kilo of maize from my 1.5 acres down from the eight bags the previous season. This time I do not think I will harvest anything. Right now we are buying our food,",maize,1,2,,,,,,,,,
"Lifestyle diseasesThe institution s Chia seed project coordinator Monica Mburu said the University had zeroed in on the seeds as one of the foods that could combat lifestyle diseases.Chia s can be a great alternative to maize farming. It is an excellent food additive and also rich in Omega 3 protein and fibre,",seeds,3,3,chia,3,3,,,,,,
"Mburu assured the farmers.The university announced that it was working with Kenya Agriculture and Livestock Research Organisation (KALRO) to produce high yielding and clean seeds for farmers, and vowed to train most of the beneficiaries on the best farming practices.The farmers also complained that they needed a thrashing machine to help them harvest clean seeds for sale.The seeds are very small and unfortunately they cannot be consumed with impurities such as stones. We need thrashing machines that can help farmers so they can produce Chia in bulk,",The university,2,2,Kenya Agriculture and Livestock Research Organisation (KALRO),2,2,seeds,4,2,,,
"she said.Researchers and varsityAccording to KALRO director Patrick Gicheru, researchers were working with the university on the perfect soil to grow Chia.Across the country, we have a challenge of low zinc and iron nutrients in the soils, but Chia seeds are able to absorb these nutrients from poor soils, which is good nutritional value of the crop,",chia,3,3,,,,,,,,,
"Maize supply has started to increase and prices continue to drop. It is a challenge as farmers continue to struggle in the maize sub-sector due to unpredictable returns,",maize,4,1,,,,,,,,,
"The government has neglected maize farming and that is why it is not budgeted for. The government may not achieve food security if it continues to ignore farmer s pleas,",The government,1,2,,,,,,,,,
"I opted to short-season crops like sorghum, millet and vegetables. Maize does not do well due to serious attacks,",sorghum,2,2,millet,2,2,vegetables,2,2,maize,1,3
"The African army worms are different from the fall army worms and this type normally eats young green maize by destroying the leafy parts of the tender plant. It is the reason why most of the affected regions have friendly breeding environment for the worms,",African army worms,1,2,,,,,,,,,
"Including the synergies expected from the acquisition of Monsanto, Bayer anticipates annual contributions of 2.6 billion euros from 2022 on as a result of its planned efficiency and structural measures,",Bayer,2,3,,,,,,,,,
"Wheat has a relatively short window to be harvested, so you need to have enough people available at the right time,",wheat,1,2,,,,,,,,,
Tobacco business changes colour,tobacco,2,3,,,,,,,,,
"I created Cotton Fest to really fill that gap where we can have people who I grew up with and some that I have birthed to come together and feel comfortable in a space that belongs to them,",Cotton Fest,2,3,,,,,,,,,
"Tobacco makes for a good vehicle to express the antibodies because it is inexpensive and it can produce a lot,",tobacco,3,3,,,,,,,,,
"Maize meal is the biggest staple food in South Africa, especially for the poor, and forms the basis for processed products like poultry, dairy and meat.",maize,2,3,,,,,,,,,
"Tobacco Sales Floor is well advanced in preparation for the tobacco marketing season which will start on 30 March 2022,",Tobacco Sales Floor,2,3,,,,,,,,,
"In the farming operations, tobacco, maize and soya bean crops are growing well and yields are expected to be satisfactory.",tobacco,3,2,maize,3,2,soya bean,3,2,,,
"Wheat is supported by three programmes, namely private banks, CBZ and Agribank; and private companies; and the Presidential Inputs Scheme. Currently, the number of wheat farmers in the country is around 2 000,",wheat,2,3,,,,,,,,,
"This is a very low price of wheat as compared to last year s price . . . This price is even lower than what should be paid for summer maize,",wheat,2,3,,,,,,,,,
Whether it is Google or Apple or free Software we got some fantastic competition and it keeps us on our toes.,Google,3,3,Apple,3,3,,,,,,
"By supporting Seed Co Group, whose activity is improving food security in the region by helping to increase agricultural yields, ProParco is contributing to the development of the economic fabric of the region, job creation, the promotion of quality industrial facilities with high environmental and social standards and the adaptation of Sub-Saharan agriculture to climate change,",Seed Co Group,3,3,ProParco,3,3,,,,,,
"The project should contribute to creating some 95 additional direct jobs and should support some 14,000 indirect jobs. In terms of the climate, the installation of a corn drying unit by Seed Co will allow external farmers to harvest their wheat earlier in the year (May or June instead of September) and thereby considerably reduce losses due to disruptions in rainy seasons,",Seed Co,3,3,,,,,,,,,
"Understanding Budget Priorities for NARO,",NARO,2,3,,,,,,,,,